{
  "event": {
    "kind": "event",
    "venue_id": "kalshi",
    "event_id": "MIN-EVENT",
    "title": "Minimal Event",
    "active": false,
    "closed": true,
    "discovered_at": "2025-11-04T10:00:00Z",
    "last_seen": "2025-11-04T10:00:00Z"
  },
  "event_id": "evt_minimal",
  "event_type": "expired",
  "timestamp": "2025-11-04T10:00:00Z",
  "venue_id": "kalshi"
}